{
  "$schema": "http://json-schema.org/draft-07/schema#",
  "$id": "electrical/lighting-layout/schemas/lighting-layout-intent.schema.json",
  "title": "Lighting Layout Intent",
  "description": "Stable subset of the lighting-layout IR that downstream skills (db-layout, cable-containment, panel-schedule, earthing) consume. The full IR includes per-luminaire positions and drawing notes — downstream skills do NOT need those. Wrapped in shared/schemas/core/intent.schema.json envelope at runtime. Forward-compat: optional fields may be added freely; required fields require a major intent_version bump. D3.A.3: extended payload with zones + circuits (incl. row_index + homerun) + switches.",
  "type": "object",
  "required": ["room_id", "circuits"],
  "additionalProperties": false,
  "properties": {
    "room_id": {
      "type": "string",
      "description": "Stable room/space identifier from the project context"
    },
    "room_type": {
      "type": "string",
      "description": "Echo of the inputs.json room_type value; helps downstream filtering"
    },
    "luminaire_summary": {
      "type": "object",
      "required": ["luminaire_count", "luminaire_wattage_w_each"],
      "properties": {
        "luminaire_count":         { "type": "integer", "minimum": 0 },
        "luminaire_wattage_w_each":{ "type": "integer", "minimum": 1 },
        "luminaire_lumens_each":   { "type": "integer", "minimum": 100 },
        "lumen_type":              { "enum": ["initial", "design"] },
        "ip_rating":               { "type": "string" }
      }
    },
    "circuits": {
      "type": "array",
      "minItems": 1,
      "items": {
        "type": "object",
        "required": ["circuit_id", "voltage_class", "load_w", "luminaire_count"],
        "additionalProperties": false,
        "properties": {
          "circuit_id":      { "type": "string", "description": "Stable circuit id, e.g. 'L1-Z2'" },
          "db_designation":  { "type": "string", "description": "Upstream DB designation (links to db-layout intent)" },
          "zone_id":         { "type": "string", "description": "Perimeter Z1 or interior Z2 etc." },
          "voltage_class":   { "enum": ["LV_power", "ELV_control", "emergency_lighting"] },
          "load_w":          { "type": "number", "minimum": 0 },
          "luminaire_count": { "type": "integer", "minimum": 1 },
          "mcb_rating_a_suggested": { "type": "integer", "enum": [6, 10, 16, 20, 32] },
          "approximate_route_length_m": { "type": "number", "exclusiveMinimum": 0 }
        }
      }
    },
    "emergency_lighting_present": {
      "type": "boolean",
      "description": "true if any emergency luminaires placed; drives earthing skill's life-safety circuit list"
    },
    "controls_summary": {
      "type": "object",
      "properties": {
        "occupancy_sensing":         { "type": "boolean" },
        "daylight_linking":          { "type": "boolean" },
        "dimming_protocol":          { "type": ["string", "null"], "enum": [null, "none", "switched", "0-10V", "DALI", "DALI-2"] },
        "part_l_assessed":           { "type": "boolean" },
        "part_l_compliant":          { "type": "boolean" }
      }
    },
    "zones": {
      "type": "array",
      "description": "D3.A.3: zone topology for downstream circuit planning and controls wiring.",
      "items": {
        "type": "object",
        "required": ["zone_id", "zone_type", "luminaire_ids", "circuit_ids"],
        "properties": {
          "zone_id":       {"type": "string"},
          "zone_type":     {"enum": ["perimeter", "interior", "task", "emergency"]},
          "control":       {"type": "string"},
          "luminaire_ids": {"type": "array", "items": {"type": "string"}},
          "circuit_ids":   {"type": "array", "items": {"type": "string"}}
        }
      }
    },
    "circuits_topology": {
      "type": "array",
      "description": "D3.A.3: extended circuit topology with row_index + homerun_endpoint for downstream routing.",
      "items": {
        "type": "object",
        "required": ["circuit_id", "row_index", "total_load_w", "mcb_rating_a", "homerun_endpoint"],
        "properties": {
          "circuit_id":      {"type": "string"},
          "zone_id":         {"type": "string"},
          "row_index":       {"type": "integer", "minimum": 0},
          "total_load_w":    {"type": "number", "minimum": 0},
          "mcb_rating_a":    {"enum": [6, 10, 16, 20, 32]},
          "mcb_curve":       {"enum": ["B", "C", "D"]},
          "homerun_endpoint": {
            "type": "object",
            "required": ["x_mm", "y_mm"],
            "properties": {
              "x_mm": {"type": "integer", "minimum": 0},
              "y_mm": {"type": "integer", "minimum": 0},
              "wall": {"enum": ["N", "S", "E", "W"]}
            }
          }
        }
      }
    },
    "switches": {
      "type": "array",
      "description": "D3.A.3: switch positions for downstream controls wiring.",
      "items": {
        "type": "object",
        "required": ["id", "type", "x_mm", "y_mm", "controls_circuit"],
        "properties": {
          "id":               {"type": "string"},
          "type":             {"type": "string"},
          "x_mm":             {"type": "integer", "minimum": 0},
          "y_mm":             {"type": "integer", "minimum": 0},
          "height_aff_mm":    {"type": "integer"},
          "controls_circuit": {"type": "string"}
        }
      }
    },
    "consumed_intents": {
      "type": "object",
      "additionalProperties": false,
      "description": "D.2 photometric-analysis + D.1 special-locations cascade integration: mirror of IR's consumed_intents block, surfaced on the intent so downstream consumers (db-layout, cable-containment, panel-schedule, earthing) see the full cascade chain without re-reading the upstream intent-out.json. Carries photometric_grid (Wave 1) and special_locations_zoning (Wave 1); future waves add emergency_coverage (Wave 3) and daylight_model (Wave 4).",
      "properties": {
        "photometric_grid": {
          "type": "object",
          "required": ["intent_version", "source_path", "payload"],
          "additionalProperties": false,
          "properties": {
            "intent_version": {"type": "string"},
            "source_path": {
              "type": "string",
              "minLength": 1,
              "description": "Path to photometric-analysis intent-out.json (typically electrical/photometric-analysis/examples/cascade-<this-example-name>/intent-out.json for shipped examples; project-specific path for real projects)"
            },
            "payload": {
              "type": "object",
              "description": "Flat photometric_grid payload per electrical/photometric-analysis/schemas/photometric-grid-intent.schema.json#/properties/photometric_grid"
            }
          }
        },
        "special_locations_zoning": {
          "type": "object",
          "required": ["intent_version", "source_path", "payload"],
          "additionalProperties": false,
          "properties": {
            "intent_version": {"type": "string"},
            "source_path": {"type": "string"},
            "payload": {"type": "object"}
          }
        }
      }
    }
  }
}
