{
  "room_id": "warehouse-highbay",
  "room_type": "warehouse",
  "luminaire_summary": {
    "luminaire_count": 20,
    "luminaire_wattage_w_each": 250,
    "luminaire_lumens_each": 22000,
    "lumen_type": "design",
    "ip_rating": "IP54"
  },
  "circuits": [
    {
      "circuit_id": "C-HB01",
      "db_designation": "L1",
      "zone_id": "Z2",
      "voltage_class": "LV_power",
      "load_w": 1250,
      "luminaire_count": 5,
      "mcb_rating_a_suggested": 10
    },
    {
      "circuit_id": "C-HB02",
      "db_designation": "L1",
      "zone_id": "Z2",
      "voltage_class": "LV_power",
      "load_w": 1250,
      "luminaire_count": 5,
      "mcb_rating_a_suggested": 10
    },
    {
      "circuit_id": "C-HB03",
      "db_designation": "L1",
      "zone_id": "Z2",
      "voltage_class": "LV_power",
      "load_w": 1250,
      "luminaire_count": 5,
      "mcb_rating_a_suggested": 10
    },
    {
      "circuit_id": "C-HB04",
      "db_designation": "L1",
      "zone_id": "Z2",
      "voltage_class": "LV_power",
      "load_w": 1250,
      "luminaire_count": 5,
      "mcb_rating_a_suggested": 10
    },
    {
      "circuit_id": "C-EM01",
      "db_designation": "LE",
      "zone_id": "Z3",
      "voltage_class": "emergency_lighting",
      "load_w": 120,
      "luminaire_count": 12,
      "mcb_rating_a_suggested": 6
    }
  ],
  "emergency_lighting_present": true,
  "controls_summary": {
    "occupancy_sensing": false,
    "daylight_linking": false,
    "dimming_protocol": null,
    "part_l_assessed": false,
    "part_l_compliant": false
  },
  "zones": [
    {
      "zone_id": "Z2",
      "zone_type": "interior",
      "control": "manual",
      "luminaire_ids": ["L01", "L02", "L03", "L04", "L05", "L06", "L07", "L08", "L09", "L10", "L11", "L12", "L13", "L14", "L15", "L16", "L17", "L18", "L19", "L20"],
      "circuit_ids": ["C-HB01", "C-HB02", "C-HB03", "C-HB04"]
    },
    {
      "zone_id": "Z3",
      "zone_type": "emergency",
      "control": "emergency_self_test",
      "luminaire_ids": ["L21", "L22", "L23", "L24", "L25", "L26", "L27", "L28", "L29", "L30", "L31", "L32"],
      "circuit_ids": ["C-EM01"]
    }
  ],
  "circuits_topology": [
    {
      "circuit_id": "C-HB01",
      "zone_id": "Z2",
      "row_index": 0,
      "total_load_w": 1250,
      "mcb_rating_a": 10,
      "mcb_curve": "B",
      "homerun_endpoint": {"x_mm": 0, "y_mm": 1500, "wall": "W"}
    },
    {
      "circuit_id": "C-HB02",
      "zone_id": "Z2",
      "row_index": 1,
      "total_load_w": 1250,
      "mcb_rating_a": 10,
      "mcb_curve": "B",
      "homerun_endpoint": {"x_mm": 0, "y_mm": 7200, "wall": "W"}
    },
    {
      "circuit_id": "C-HB03",
      "zone_id": "Z2",
      "row_index": 2,
      "total_load_w": 1250,
      "mcb_rating_a": 10,
      "mcb_curve": "B",
      "homerun_endpoint": {"x_mm": 0, "y_mm": 12800, "wall": "W"}
    },
    {
      "circuit_id": "C-HB04",
      "zone_id": "Z2",
      "row_index": 3,
      "total_load_w": 1250,
      "mcb_rating_a": 10,
      "mcb_curve": "B",
      "homerun_endpoint": {"x_mm": 0, "y_mm": 18500, "wall": "W"}
    },
    {
      "circuit_id": "C-EM01",
      "zone_id": "Z3",
      "row_index": 0,
      "total_load_w": 120,
      "mcb_rating_a": 6,
      "mcb_curve": "B",
      "homerun_endpoint": {"x_mm": 0, "y_mm": 10000, "wall": "W"}
    }
  ],
  "switches": [
    {
      "id": "SW01",
      "type": "1_gang",
      "x_mm": 14500,
      "y_mm": 200,
      "height_aff_mm": 1200,
      "controls_circuit": "C-HB01,C-HB02,C-HB03,C-HB04"
    }
  ]
}
