{
  "room_id": "uk-multi-entrance-classroom",
  "room_type": "classroom",
  "luminaire_summary": {
    "luminaire_count": 16,
    "luminaire_wattage_w_each": 36,
    "luminaire_lumens_each": 4500,
    "lumen_type": "design",
    "ip_rating": "IP20"
  },
  "circuits": [
    {
      "circuit_id": "C-L01",
      "db_designation": "L1",
      "zone_id": "Z1",
      "voltage_class": "LV_power",
      "load_w": 144,
      "luminaire_count": 4,
      "mcb_rating_a_suggested": 6
    },
    {
      "circuit_id": "C-L02",
      "db_designation": "L1",
      "zone_id": "Z2",
      "voltage_class": "LV_power",
      "load_w": 144,
      "luminaire_count": 4,
      "mcb_rating_a_suggested": 6
    },
    {
      "circuit_id": "C-L03",
      "db_designation": "L1",
      "zone_id": "Z2",
      "voltage_class": "LV_power",
      "load_w": 144,
      "luminaire_count": 4,
      "mcb_rating_a_suggested": 6
    },
    {
      "circuit_id": "C-L04",
      "db_designation": "L1",
      "zone_id": "Z2",
      "voltage_class": "LV_power",
      "load_w": 144,
      "luminaire_count": 4,
      "mcb_rating_a_suggested": 6
    }
  ],
  "emergency_lighting_present": false,
  "controls_summary": {
    "occupancy_sensing": true,
    "daylight_linking": true,
    "dimming_protocol": "0-10V",
    "part_l_assessed": true,
    "part_l_compliant": true
  },
  "zones": [
    {
      "zone_id": "Z1",
      "zone_type": "perimeter",
      "control": "daylight_linked",
      "luminaire_ids": ["L01", "L02", "L03", "L04"],
      "circuit_ids": ["C-L01"]
    },
    {
      "zone_id": "Z2",
      "zone_type": "interior",
      "control": "occupancy",
      "luminaire_ids": ["L05", "L06", "L07", "L08", "L09", "L10", "L11", "L12", "L13", "L14", "L15", "L16"],
      "circuit_ids": ["C-L02", "C-L03", "C-L04"]
    }
  ],
  "circuits_topology": [
    {
      "circuit_id": "C-L01",
      "zone_id": "Z1",
      "row_index": 0,
      "total_load_w": 144,
      "mcb_rating_a": 6,
      "mcb_curve": "B",
      "homerun_endpoint": {"x_mm": 0, "y_mm": 300, "wall": "W"}
    },
    {
      "circuit_id": "C-L02",
      "zone_id": "Z2",
      "row_index": 1,
      "total_load_w": 144,
      "mcb_rating_a": 6,
      "mcb_curve": "B",
      "homerun_endpoint": {"x_mm": 0, "y_mm": 2767, "wall": "W"}
    },
    {
      "circuit_id": "C-L03",
      "zone_id": "Z2",
      "row_index": 2,
      "total_load_w": 144,
      "mcb_rating_a": 6,
      "mcb_curve": "B",
      "homerun_endpoint": {"x_mm": 0, "y_mm": 5233, "wall": "W"}
    },
    {
      "circuit_id": "C-L04",
      "zone_id": "Z2",
      "row_index": 3,
      "total_load_w": 144,
      "mcb_rating_a": 6,
      "mcb_curve": "B",
      "homerun_endpoint": {"x_mm": 0, "y_mm": 7700, "wall": "W"}
    }
  ],
  "switches": [
    {
      "id": "SW01",
      "type": "2_gang",
      "x_mm": 4600,
      "y_mm": 200,
      "height_aff_mm": 1200,
      "controls_circuit": "C-L01,C-L02"
    },
    {
      "id": "SW02",
      "type": "1_gang",
      "x_mm": 6800,
      "y_mm": 7800,
      "height_aff_mm": 1200,
      "controls_circuit": "C-L04"
    },
    {
      "id": "SW03",
      "type": "1_gang",
      "x_mm": 200,
      "y_mm": 2800,
      "height_aff_mm": 1200,
      "controls_circuit": "C-L03"
    }
  ]
}
