{
  "room_id": "uk-retail-display-task-zone",
  "room_type": "reception_lobby",
  "luminaire_summary": {
    "luminaire_count": 16,
    "luminaire_wattage_w_each": 18,
    "luminaire_lumens_each": 1800,
    "lumen_type": "design",
    "ip_rating": "IP20",
    "mount_type": "mixed",
    "z_mm": 2500,
    "suspension_length_mm": 1500
  },
  "circuits": [
    {
      "circuit_id": "C-L01",
      "db_designation": "L1",
      "zone_id": "Z1",
      "voltage_class": "LV_power",
      "load_w": 120,
      "luminaire_count": 4,
      "mcb_rating_a_suggested": 6
    },
    {
      "circuit_id": "C-L02",
      "db_designation": "L1",
      "zone_id": "Z2",
      "voltage_class": "LV_power",
      "load_w": 54,
      "luminaire_count": 3,
      "mcb_rating_a_suggested": 6
    },
    {
      "circuit_id": "C-L03",
      "db_designation": "L1",
      "zone_id": "Z2",
      "voltage_class": "LV_power",
      "load_w": 54,
      "luminaire_count": 3,
      "mcb_rating_a_suggested": 6
    },
    {
      "circuit_id": "C-L04",
      "db_designation": "L1",
      "zone_id": "Z2",
      "voltage_class": "LV_power",
      "load_w": 54,
      "luminaire_count": 3,
      "mcb_rating_a_suggested": 6
    },
    {
      "circuit_id": "C-L05",
      "db_designation": "L1",
      "zone_id": "Z2",
      "voltage_class": "LV_power",
      "load_w": 54,
      "luminaire_count": 3,
      "mcb_rating_a_suggested": 6
    }
  ],
  "emergency_lighting_present": false,
  "controls_summary": {
    "occupancy_sensing": true,
    "daylight_linking": false,
    "dimming_protocol": "DALI",
    "part_l_assessed": true,
    "part_l_compliant": true
  },
  "zones": [
    {
      "zone_id": "Z1",
      "zone_type": "task",
      "control": "dali_master",
      "luminaire_ids": ["L01", "L02", "L03", "L04"],
      "circuit_ids": ["C-L01"],
      "purpose": "task",
      "em_target_lux": 1000
    },
    {
      "zone_id": "Z2",
      "zone_type": "interior",
      "control": "dali_master",
      "luminaire_ids": ["L05", "L06", "L07", "L08", "L09", "L10", "L11", "L12", "L13", "L14", "L15", "L16"],
      "circuit_ids": ["C-L02", "C-L03", "C-L04", "C-L05"],
      "purpose": "circulation",
      "em_target_lux": 300
    }
  ],
  "circuits_topology": [
    {
      "circuit_id": "C-L01",
      "zone_id": "Z1",
      "row_index": 2,
      "total_load_w": 120,
      "mcb_rating_a": 6,
      "mcb_curve": "B",
      "homerun_endpoint": {"x_mm": 0, "y_mm": 5000, "wall": "W"}
    },
    {
      "circuit_id": "C-L02",
      "zone_id": "Z2",
      "row_index": 0,
      "total_load_w": 54,
      "mcb_rating_a": 6,
      "mcb_curve": "B",
      "homerun_endpoint": {"x_mm": 0, "y_mm": 1500, "wall": "W"}
    },
    {
      "circuit_id": "C-L03",
      "zone_id": "Z2",
      "row_index": 1,
      "total_load_w": 54,
      "mcb_rating_a": 6,
      "mcb_curve": "B",
      "homerun_endpoint": {"x_mm": 0, "y_mm": 3500, "wall": "W"}
    },
    {
      "circuit_id": "C-L04",
      "zone_id": "Z2",
      "row_index": 3,
      "total_load_w": 54,
      "mcb_rating_a": 6,
      "mcb_curve": "B",
      "homerun_endpoint": {"x_mm": 0, "y_mm": 6500, "wall": "W"}
    },
    {
      "circuit_id": "C-L05",
      "zone_id": "Z2",
      "row_index": 4,
      "total_load_w": 54,
      "mcb_rating_a": 6,
      "mcb_curve": "B",
      "homerun_endpoint": {"x_mm": 0, "y_mm": 8500, "wall": "W"}
    }
  ],
  "switches": [
    {
      "id": "SW01",
      "type": "dali_master",
      "x_mm": 9050,
      "y_mm": 200,
      "height_aff_mm": 1200,
      "controls_circuit": "C-L01,C-L02,C-L03,C-L04,C-L05"
    }
  ],
  "consumed_intents": {
    "photometric_grid": {
      "intent_version": "1.0.0",
      "source_path": "electrical/photometric-analysis/examples/cascade-uk-retail-display-task-zone/intent-out.json",
      "payload": {
        "achieved_avg_illuminance_lux": 1058,
        "achieved_min_illuminance_lux": 445,
        "achieved_uniformity_u0": 0.42,
        "ugr_max": 18.6,
        "ugr_target": 19,
        "uniformity_target": 0.4,
        "target_illuminance_lux": 1000,
        "task_area_compliant": true,
        "grid_point_count": 120,
        "non_compliance_flags": [],
        "ies_source_summary": {
          "all_verified": false,
          "verification_status_lowest": "synthetic_reference_C3"
        }
      }
    }
  }
}
